Credit Union,City,State
Augusta Health Care Credit Union,Fishersville,VA
Baylands Family Credit Union,West Point,VA
Beacon Credit Union,Lynchburg,VA
Blue Eagle Credit Union,Roanoke,VA
Credit Union of Richmond,Richmond,VA
Dominion Energy Credit Union,Richmond,VA
DuPont Community Credit Union,Waynesboro,VA
Hampton Roads Educators Credit Union,Hampton,VA
Jackson River Community Credit Union,Covington,VA
Loudoun Credit Union,Leesburg,VA
Newport News Municipal Employees Credit Union,Newport News,VA
Northern Star Credit Union,Portsmouth,VA
PFD Firefighters Credit Union,Portsmouth,VA
Richmond Virginia Fire Police Credit Union,Richmond,VA
University of Virginia Community Credit Union,Charlottesville,VA
ValleyStar Credit Union,Martinsville,VA
Virginia Educators' Credit Union,Newport News,VA
Virginia United Methodist Credit Union,North Chesterfield,VA
